{"confidence_id":"EQA-CONF-EXAMPLE-001","level":"moderate","basis":"direct object comparison but partial reviewer agreement","evidence_completeness":"complete","source_access":"direct","agreement":"partial","rule_clarity":"clear","input_quality":"good","consequence":"moderate","reversibility":"easy","route_stability":"known","uncertainty_reason":"owner must choose structure","residual_risk":"moderate","escalation_required":true}
